{
  "certificate_id": "cert_2974a3e1e9de7013",
  "hand_canonical": [
    "9c",
    "Jd",
    "Qd",
    "Kd",
    "Ad"
  ],
  "hand_input": [
    "As",
    "Ks",
    "Qs",
    "Js",
    "9c"
  ],
  "ruleset_id": "jacks_or_better.full_pay_9_6.v1",
  "ruleset_version": "1.0.0",
  "strategy_version": "1.0.0",
  "all_holds": [
    {
      "mask": 15,
      "held_cards": [
        "As",
        "Ks",
        "Qs",
        "Js"
      ],
      "exact_ev": {
        "numerator": "872",
        "denominator": "47",
        "decimal_approx": 18.5531914893617
      },
      "total_combinations": 47,
      "outcome_counts": {
        "ROYAL_FLUSH": 1,
        "STRAIGHT_FLUSH": 0,
        "FOUR_OF_A_KIND": 0,
        "FULL_HOUSE": 0,
        "FLUSH": 8,
        "STRAIGHT": 3,
        "THREE_OF_A_KIND": 0,
        "TWO_PAIR": 0,
        "JACKS_OR_BETTER": 12,
        "NOTHING": 23
      }
    },
    {
      "mask": 14,
      "held_cards": [
        "Ks",
        "Qs",
        "Js"
      ],
      "exact_ev": {
        "numerator": "778",
        "denominator": "1081",
        "decimal_approx": 0.7197039777983348
      },
      "total_combinations": 1081,
      "outcome_counts": {
        "ROYAL_FLUSH": 0,
        "STRAIGHT_FLUSH": 1,
        "FOUR_OF_A_KIND": 0,
        "FULL_HOUSE": 0,
        "FLUSH": 35,
        "STRAIGHT": 23,
        "THREE_OF_A_KIND": 9,
        "TWO_PAIR": 27,
        "JACKS_OR_BETTER": 345,
        "NOTHING": 641
      }
    },
    {
      "mask": 7,
      "held_cards": [
        "As",
        "Ks",
        "Qs"
      ],
      "exact_ev": {
        "numerator": "30",
        "denominator": "47",
        "decimal_approx": 0.6382978723404256
      },
      "total_combinations": 1081,
      "outcome_counts": {
        "ROYAL_FLUSH": 0,
        "STRAIGHT_FLUSH": 0,
        "FOUR_OF_A_KIND": 0,
        "FULL_HOUSE": 0,
        "FLUSH": 36,
        "STRAIGHT": 12,
        "THREE_OF_A_KIND": 9,
        "TWO_PAIR": 27,
        "JACKS_OR_BETTER": 345,
        "NOTHING": 652
      }
    },
    {
      "mask": 11,
      "held_cards": [
        "As",
        "Ks",
        "Js"
      ],
      "exact_ev": {
        "numerator": "30",
        "denominator": "47",
        "decimal_approx": 0.6382978723404256
      },
      "total_combinations": 1081,
      "outcome_counts": {
        "ROYAL_FLUSH": 0,
        "STRAIGHT_FLUSH": 0,
        "FOUR_OF_A_KIND": 0,
        "FULL_HOUSE": 0,
        "FLUSH": 36,
        "STRAIGHT": 12,
        "THREE_OF_A_KIND": 9,
        "TWO_PAIR": 27,
        "JACKS_OR_BETTER": 345,
        "NOTHING": 652
      }
    },
    {
      "mask": 13,
      "held_cards": [
        "As",
        "Qs",
        "Js"
      ],
      "exact_ev": {
        "numerator": "30",
        "denominator": "47",
        "decimal_approx": 0.6382978723404256
      },
      "total_combinations": 1081,
      "outcome_counts": {
        "ROYAL_FLUSH": 0,
        "STRAIGHT_FLUSH": 0,
        "FOUR_OF_A_KIND": 0,
        "FULL_HOUSE": 0,
        "FLUSH": 36,
        "STRAIGHT": 12,
        "THREE_OF_A_KIND": 9,
        "TWO_PAIR": 27,
        "JACKS_OR_BETTER": 345,
        "NOTHING": 652
      }
    },
    {
      "mask": 30,
      "held_cards": [
        "Ks",
        "Qs",
        "Js",
        "9c"
      ],
      "exact_ev": {
        "numerator": "25",
        "denominator": "47",
        "decimal_approx": 0.5319148936170213
      },
      "total_combinations": 47,
      "outcome_counts": {
        "ROYAL_FLUSH": 0,
        "STRAIGHT_FLUSH": 0,
        "FOUR_OF_A_KIND": 0,
        "FULL_HOUSE": 0,
        "FLUSH": 0,
        "STRAIGHT": 4,
        "THREE_OF_A_KIND": 0,
        "TWO_PAIR": 0,
        "JACKS_OR_BETTER": 9,
        "NOTHING": 34
      }
    },
    {
      "mask": 12,
      "held_cards": [
        "Qs",
        "Js"
      ],
      "exact_ev": {
        "numerator": "2769",
        "denominator": "5405",
        "decimal_approx": 0.5123034227567067
      },
      "total_combinations": 16215,
      "outcome_counts": {
        "ROYAL_FLUSH": 0,
        "STRAIGHT_FLUSH": 1,
        "FOUR_OF_A_KIND": 2,
        "FULL_HOUSE": 18,
        "FLUSH": 83,
        "STRAIGHT": 119,
        "THREE_OF_A_KIND": 281,
        "TWO_PAIR": 711,
        "JACKS_OR_BETTER": 4806,
        "NOTHING": 10194
      }
    },
    {
      "mask": 6,
      "held_cards": [
        "Ks",
        "Qs"
      ],
      "exact_ev": {
        "numerator": "1615",
        "denominator": "3243",
        "decimal_approx": 0.49799568300955904
      },
      "total_combinations": 16215,
      "outcome_counts": {
        "ROYAL_FLUSH": 0,
        "STRAIGHT_FLUSH": 0,
        "FOUR_OF_A_KIND": 2,
        "FULL_HOUSE": 18,
        "FLUSH": 84,
        "STRAIGHT": 72,
        "THREE_OF_A_KIND": 281,
        "TWO_PAIR": 711,
        "JACKS_OR_BETTER": 4806,
        "NOTHING": 10241
      }
    },
    {
      "mask": 10,
      "held_cards": [
        "Ks",
        "Js"
      ],
      "exact_ev": {
        "numerator": "1615",
        "denominator": "3243",
        "decimal_approx": 0.49799568300955904
      },
      "total_combinations": 16215,
      "outcome_counts": {
        "ROYAL_FLUSH": 0,
        "STRAIGHT_FLUSH": 0,
        "FOUR_OF_A_KIND": 2,
        "FULL_HOUSE": 18,
        "FLUSH": 84,
        "STRAIGHT": 72,
        "THREE_OF_A_KIND": 281,
        "TWO_PAIR": 711,
        "JACKS_OR_BETTER": 4806,
        "NOTHING": 10241
      }
    },
    {
      "mask": 3,
      "held_cards": [
        "As",
        "Ks"
      ],
      "exact_ev": {
        "numerator": "7931",
        "denominator": "16215",
        "decimal_approx": 0.4891150169596053
      },
      "total_combinations": 16215,
      "outcome_counts": {
        "ROYAL_FLUSH": 0,
        "STRAIGHT_FLUSH": 0,
        "FOUR_OF_A_KIND": 2,
        "FULL_HOUSE": 18,
        "FLUSH": 84,
        "STRAIGHT": 36,
        "THREE_OF_A_KIND": 281,
        "TWO_PAIR": 711,
        "JACKS_OR_BETTER": 4806,
        "NOTHING": 10277
      }
    },
    {
      "mask": 5,
      "held_cards": [
        "As",
        "Qs"
      ],
      "exact_ev": {
        "numerator": "7931",
        "denominator": "16215",
        "decimal_approx": 0.4891150169596053
      },
      "total_combinations": 16215,
      "outcome_counts": {
        "ROYAL_FLUSH": 0,
        "STRAIGHT_FLUSH": 0,
        "FOUR_OF_A_KIND": 2,
        "FULL_HOUSE": 18,
        "FLUSH": 84,
        "STRAIGHT": 36,
        "THREE_OF_A_KIND": 281,
        "TWO_PAIR": 711,
        "JACKS_OR_BETTER": 4806,
        "NOTHING": 10277
      }
    },
    {
      "mask": 9,
      "held_cards": [
        "As",
        "Js"
      ],
      "exact_ev": {
        "numerator": "7931",
        "denominator": "16215",
        "decimal_approx": 0.4891150169596053
      },
      "total_combinations": 16215,
      "outcome_counts": {
        "ROYAL_FLUSH": 0,
        "STRAIGHT_FLUSH": 0,
        "FOUR_OF_A_KIND": 2,
        "FULL_HOUSE": 18,
        "FLUSH": 84,
        "STRAIGHT": 36,
        "THREE_OF_A_KIND": 281,
        "TWO_PAIR": 711,
        "JACKS_OR_BETTER": 4806,
        "NOTHING": 10277
      }
    },
    {
      "mask": 8,
      "held_cards": [
        "Js"
      ],
      "exact_ev": {
        "numerator": "15241",
        "denominator": "35673",
        "decimal_approx": 0.4272418916267205
      },
      "total_combinations": 178365,
      "outcome_counts": {
        "ROYAL_FLUSH": 0,
        "STRAIGHT_FLUSH": 1,
        "FOUR_OF_A_KIND": 52,
        "FULL_HOUSE": 288,
        "FLUSH": 125,
        "STRAIGHT": 551,
        "THREE_OF_A_KIND": 4102,
        "TWO_PAIR": 8874,
        "JACKS_OR_BETTER": 39255,
        "NOTHING": 125117
      }
    },
    {
      "mask": 1,
      "held_cards": [
        "As"
      ],
      "exact_ev": {
        "numerator": "25151",
        "denominator": "59455",
        "decimal_approx": 0.4230258178454293
      },
      "total_combinations": 178365,
      "outcome_counts": {
        "ROYAL_FLUSH": 0,
        "STRAIGHT_FLUSH": 1,
        "FOUR_OF_A_KIND": 52,
        "FULL_HOUSE": 288,
        "FLUSH": 125,
        "STRAIGHT": 363,
        "THREE_OF_A_KIND": 4102,
        "TWO_PAIR": 8874,
        "JACKS_OR_BETTER": 39255,
        "NOTHING": 125305
      }
    },
    {
      "mask": 4,
      "held_cards": [
        "Qs"
      ],
      "exact_ev": {
        "numerator": "75397",
        "denominator": "178365",
        "decimal_approx": 0.4227118549042693
      },
      "total_combinations": 178365,
      "outcome_counts": {
        "ROYAL_FLUSH": 0,
        "STRAIGHT_FLUSH": 0,
        "FOUR_OF_A_KIND": 52,
        "FULL_HOUSE": 288,
        "FLUSH": 126,
        "STRAIGHT": 360,
        "THREE_OF_A_KIND": 4102,
        "TWO_PAIR": 8874,
        "JACKS_OR_BETTER": 39255,
        "NOTHING": 125308
      }
    },
    {
      "mask": 2,
      "held_cards": [
        "Ks"
      ],
      "exact_ev": {
        "numerator": "74821",
        "denominator": "178365",
        "decimal_approx": 0.41948252179519524
      },
      "total_combinations": 178365,
      "outcome_counts": {
        "ROYAL_FLUSH": 0,
        "STRAIGHT_FLUSH": 0,
        "FOUR_OF_A_KIND": 52,
        "FULL_HOUSE": 288,
        "FLUSH": 126,
        "STRAIGHT": 216,
        "THREE_OF_A_KIND": 4102,
        "TWO_PAIR": 8874,
        "JACKS_OR_BETTER": 39255,
        "NOTHING": 125452
      }
    },
    {
      "mask": 28,
      "held_cards": [
        "Qs",
        "Js",
        "9c"
      ],
      "exact_ev": {
        "numerator": "427",
        "denominator": "1081",
        "decimal_approx": 0.395004625346901
      },
      "total_combinations": 1081,
      "outcome_counts": {
        "ROYAL_FLUSH": 0,
        "STRAIGHT_FLUSH": 0,
        "FOUR_OF_A_KIND": 0,
        "FULL_HOUSE": 0,
        "FLUSH": 0,
        "STRAIGHT": 28,
        "THREE_OF_A_KIND": 9,
        "TWO_PAIR": 27,
        "JACKS_OR_BETTER": 234,
        "NOTHING": 783
      }
    },
    {
      "mask": 24,
      "held_cards": [
        "Js",
        "9c"
      ],
      "exact_ev": {